{
  "schema_version": "1.0.0",
  "packet_id": "P0-007B",
  "packet_sha256": "33596091ae66a0a47c9d4ec6d23586b23bcf2d5ae07e51d0c9436f0186c36263",
  "git_commit": "754f95e8f560fca99657884adaa03fa59165dbf3",
  "run_id": "20260823T085543Z-local",
  "environment": {
    "kind": "mixed",
    "validation_host": "local_m1",
    "certified_measurement_host": "clearx-mantra-g2-l4-v1",
    "conda_environment": "clearx"
  },
  "commands": [
    {
      "command": "python tools/inventory/validate_deployment_acceptance.py deployment_acceptance.json",
      "exit_code": 0
    }
  ],
  "artifacts": [
    {"path": "docs/deployment_acceptance.md", "sha256": "19d2b629c97bdc0ea0cd62e59c253fe316adee70bc0cca55aed11fc4cfb1a2bc", "size_bytes": 2787},
    {"path": "deployment_acceptance.json", "sha256": "c2d930debb9f1e4e06584ebb0268b56cdabc4c05ba0f0e130f74a5c2df719506", "size_bytes": 3677}
  ],
  "required_checks": {
    "all_terms_resolve": true,
    "host_digest_bound": true,
    "workloads_named": true,
    "thresholds_frozen": true
  },
  "outcome": "complete",
  "deviations": [],
  "started_at": "2026-08-23T08:53:50Z",
  "finished_at": "2026-08-23T08:55:43Z"
}
